packageName,policyEntity,policyAction,policyData,policySentences,contradictionNum,contradictoryEntity,contradictoryAction,contradictoryData,contradictionSentences
com.geeker.gok,third party,collect,pii,We may share your information (in some cases personal information) with third parties other than Lightning Studios who may be located in the circumstances below.,C1,third party,not_collect,pii,"We will not rent or sell your personal data to any third parties, but we may share your information from tools like log files, device identifiers, and location data with third-party organizations that provide automatic data processing technologies for the App."
com.emoji.flashlight,we,collect,pii,"We will try to delete relevant data as soon as possible if we are aware that we have collected the personal data of a minor without the prior consent of their certified guardians.||This policy will help you understand the followings: how We Collect and Use Your Personal Data||We will use your personal data in strict compliance with the purposes set forth in this Policy.||We may collect your personal data as follows while we are providing services.||We may share your personal data with our affiliated companies and will ensure their processing of your personal data is in compliance with the purposes and requirements of this Policy.||We may share your personal data with our subsidiary products to provide a more consistent experience and better service.||We will store your personal data for the necessary period for data collection and processing purposes.||To prevent fraud and cheating, in order to ensure the normal operation of our business that provide you with better services and ecological environment, we need to obtain some necessary data, including: application package name, application version, application installation time, application signature and other applications Information; Android ID, country code, startup time, system time, memory information, system version, power, volume information, Bluetooth information, SIM card status and identification information, storage information and other system information; screen resolution, mobile brand, mobile phone Type, sensor information, camera information, CPU information, GPU information and other device information; location information, headset pluggable information, application installation and use information, screen unlocking information, Wi-Fi list information, network information and other user use information.||We will no longer use your personal data for the above-mentioned commercial promotion purposes when you refuse to receive interest-based advertisements. Non-personalized ads dont use mobile ad identifiers for ad targeting, they do still use mobile ad identifiers for frequency capping, aggregated ad reporting, and to combat fraud and abuse.||We will inform you in advance and obtain your consent before we use these data for any other purposes than set forth in this Policy or we use the personal data collected for specific purposes for other purposes.",C1,we,not_collect,pii,"For now, we do not obtain your personal data from any third party."
com.emoji.flashlight,we,not_collect,pii,"For now, we do not obtain your personal data from any third party.",C1,we,collect,pii,"We will try to delete relevant data as soon as possible if we are aware that we have collected the personal data of a minor without the prior consent of their certified guardians.||This policy will help you understand the followings: how We Collect and Use Your Personal Data||We will use your personal data in strict compliance with the purposes set forth in this Policy.||We may collect your personal data as follows while we are providing services.||We may share your personal data with our affiliated companies and will ensure their processing of your personal data is in compliance with the purposes and requirements of this Policy.||We may share your personal data with our subsidiary products to provide a more consistent experience and better service.||We will store your personal data for the necessary period for data collection and processing purposes.||To prevent fraud and cheating, in order to ensure the normal operation of our business that provide you with better services and ecological environment, we need to obtain some necessary data, including: application package name, application version, application installation time, application signature and other applications Information; Android ID, country code, startup time, system time, memory information, system version, power, volume information, Bluetooth information, SIM card status and identification information, storage information and other system information; screen resolution, mobile brand, mobile phone Type, sensor information, camera information, CPU information, GPU information and other device information; location information, headset pluggable information, application installation and use information, screen unlocking information, Wi-Fi list information, network information and other user use information.||We will no longer use your personal data for the above-mentioned commercial promotion purposes when you refuse to receive interest-based advertisements. Non-personalized ads dont use mobile ad identifiers for ad targeting, they do still use mobile ad identifiers for frequency capping, aggregated ad reporting, and to combat fraud and abuse.||We will inform you in advance and obtain your consent before we use these data for any other purposes than set forth in this Policy or we use the personal data collected for specific purposes for other purposes."
com.emoji.flashlight,we,collect,device information,"To prevent fraud and cheating, in order to ensure the normal operation of our business that provide you with better services and ecological environment, we need to obtain some necessary data, including: application package name, application version, application installation time, application signature and other applications Information; Android ID, country code, startup time, system time, memory information, system version, power, volume information, Bluetooth information, SIM card status and identification information, storage information and other system information; screen resolution, mobile brand, mobile phone Type, sensor information, camera information, CPU information, GPU information and other device information; location information, headset pluggable information, application installation and use information, screen unlocking information, Wi-Fi list information, network information and other user use information.",C6,we,not_collect,pii,"For now, we do not obtain your personal data from any third party."
com.emoji.flashlight,we,collect,geographical location,"To prevent fraud and cheating, in order to ensure the normal operation of our business that provide you with better services and ecological environment, we need to obtain some necessary data, including: application package name, application version, application installation time, application signature and other applications Information; Android ID, country code, startup time, system time, memory information, system version, power, volume information, Bluetooth information, SIM card status and identification information, storage information and other system information; screen resolution, mobile brand, mobile phone Type, sensor information, camera information, CPU information, GPU information and other device information; location information, headset pluggable information, application installation and use information, screen unlocking information, Wi-Fi list information, network information and other user use information.",C2,we,not_collect,pii,"For now, we do not obtain your personal data from any third party."
com.emoji.flashlight,we,collect,android id,"To prevent fraud and cheating, in order to ensure the normal operation of our business that provide you with better services and ecological environment, we need to obtain some necessary data, including: application package name, application version, application installation time, application signature and other applications Information; Android ID, country code, startup time, system time, memory information, system version, power, volume information, Bluetooth information, SIM card status and identification information, storage information and other system information; screen resolution, mobile brand, mobile phone Type, sensor information, camera information, CPU information, GPU information and other device information; location information, headset pluggable information, application installation and use information, screen unlocking information, Wi-Fi list information, network information and other user use information.",C2,we,not_collect,pii,"For now, we do not obtain your personal data from any third party."
com.emoji.flashlight,we,collect,network information,"To prevent fraud and cheating, in order to ensure the normal operation of our business that provide you with better services and ecological environment, we need to obtain some necessary data, including: application package name, application version, application installation time, application signature and other applications Information; Android ID, country code, startup time, system time, memory information, system version, power, volume information, Bluetooth information, SIM card status and identification information, storage information and other system information; screen resolution, mobile brand, mobile phone Type, sensor information, camera information, CPU information, GPU information and other device information; location information, headset pluggable information, application installation and use information, screen unlocking information, Wi-Fi list information, network information and other user use information.",C6,we,not_collect,pii,"For now, we do not obtain your personal data from any third party."
com.emirates.ek.android,third party,collect,pii,"These third parties may have their own privacy policies that also apply to you; and may use your personal information to meet their own business purposes and legal requirements.||If we share your personal information with carefully selected third parties for the third party's own marketing purposes and you are a California resident, you may contact us once per year to request the name of that third party(ies) and the categories of information shared about you.||To this end where we transfer your personal information outside the Emirates Group or to third parties (who help us to provide our products and services), we obtain contractual commitments from them to protect your personal information; or||These third parties have agreed to confidentiality obligations and use any personal information we share with them or which they collect on our behalf solely for the purposes of providing the contracted service to us.",C1,third party,not_collect,pii,You can request that we not transfer your personal information to unaffiliated third parties for the purposes of direct marketing or any other purposes.
com.emirates.ek.android,advertising network,collect,pii,"If we share your personal information with carefully selected third parties for the third party's own marketing purposes and you are a California resident, you may contact us once per year to request the name of that third party(ies) and the categories of information shared about you.||We share your personal information in the manner and for the purposes described below we work with third party advertising and social media platforms to provide more personalised advertising promoting our products and services in accordance with your preferences as detailed in Personal information we collect and use for marketing purposes, profiling and analytics below; and",C3,third party,not_collect,pii,You can request that we not transfer your personal information to unaffiliated third parties for the purposes of direct marketing or any other purposes.
com.emirates.ek.android,social network,collect,pii,"We share your personal information in the manner and for the purposes described below we work with third party advertising and social media platforms to provide more personalised advertising promoting our products and services in accordance with your preferences as detailed in Personal information we collect and use for marketing purposes, profiling and analytics below; and||The social media platforms will not identify you or share other personal information in your social media account to us.",C3,third party,not_collect,pii,You can request that we not transfer your personal information to unaffiliated third parties for the purposes of direct marketing or any other purposes.
com.emirates.ek.android,third party,not_collect,pii,You can request that we not transfer your personal information to unaffiliated third parties for the purposes of direct marketing or any other purposes.,C1,third party,collect,pii,"These third parties may have their own privacy policies that also apply to you; and may use your personal information to meet their own business purposes and legal requirements.||If we share your personal information with carefully selected third parties for the third party's own marketing purposes and you are a California resident, you may contact us once per year to request the name of that third party(ies) and the categories of information shared about you.||To this end where we transfer your personal information outside the Emirates Group or to third parties (who help us to provide our products and services), we obtain contractual commitments from them to protect your personal information; or||These third parties have agreed to confidentiality obligations and use any personal information we share with them or which they collect on our behalf solely for the purposes of providing the contracted service to us."
com.versusevil.likeaboss,we,collect,identifier,"If you use our Sites, Services, or Software from a mobile phone or device, we may collect information from that device, including your device type, unique identifier, and other data you chose to provide or share in accordance with your wireless provider's terms of use.",C2,we,not_collect,pii,You can also ask us not to collect or use your personal information for certain purposes.||You also have the right to request that we not collect or use your personal information.||We do not knowingly collect personally identifiable information from anyone under the relevant age threshold applicable to the country or jurisdiction where a user may reside.
com.versusevil.likeaboss,we,collect,pii,"We do not sell your Personal Information.||If you are a resident of California and want additional information confirming how we share your personally identifiable information with third parties for their direct marketing purposes, you may contact us at privacy@vsevil.net.||We store your personal information within the United States of America, and we take prudent security measures to protect you and the information we collect from unauthorized access, alteration, disclosure, and destruction.||If you prefer that we not share your personal information with third-party advertising partners, you may contact us at privacy@vsevil.net.||If we later learn that we have inadvertently gathered personal information from a child under the age of 13, regardless of where that child resides, we will remove this information from our records as quickly as possible.||You have the right to know what personal information we collect from you, and you may request that we remove it from our servers and systems at any time.",C1,we,not_collect,pii,You can also ask us not to collect or use your personal information for certain purposes.||You also have the right to request that we not collect or use your personal information.||We do not knowingly collect personally identifiable information from anyone under the relevant age threshold applicable to the country or jurisdiction where a user may reside.
com.versusevil.likeaboss,we,not_collect,pii,You can also ask us not to collect or use your personal information for certain purposes.||You also have the right to request that we not collect or use your personal information.||We do not knowingly collect personally identifiable information from anyone under the relevant age threshold applicable to the country or jurisdiction where a user may reside.,C1,we,collect,pii,"We do not sell your Personal Information.||If you are a resident of California and want additional information confirming how we share your personally identifiable information with third parties for their direct marketing purposes, you may contact us at privacy@vsevil.net.||We store your personal information within the United States of America, and we take prudent security measures to protect you and the information we collect from unauthorized access, alteration, disclosure, and destruction.||If you prefer that we not share your personal information with third-party advertising partners, you may contact us at privacy@vsevil.net.||If we later learn that we have inadvertently gathered personal information from a child under the age of 13, regardless of where that child resides, we will remove this information from our records as quickly as possible.||You have the right to know what personal information we collect from you, and you may request that we remove it from our servers and systems at any time."
com.versusevil.likeaboss,we,collect,email address,"When you submit this information to us, we may collect your name or username and email address to follow up with you or thank you for your suggestion.||When you use third-party services to purchase our Software and Services, for example, Value's Steam, Sony (for PlayStation platforms and services), Microsoft (for Xbox and Windows platforms and services), Epic (for Epic Games platform and services), and similar distribution services, we may obtain your name, email address, online ID, country, state or province, language, date of birth, and other social information you provide to them.",C2,we,not_collect,pii,You can also ask us not to collect or use your personal information for certain purposes.||You also have the right to request that we not collect or use your personal information.||We do not knowingly collect personally identifiable information from anyone under the relevant age threshold applicable to the country or jurisdiction where a user may reside.
com.versusevil.likeaboss,we,collect,person name,"When you submit this information to us, we may collect your name or username and email address to follow up with you or thank you for your suggestion.||When you use third-party services to purchase our Software and Services, for example, Value's Steam, Sony (for PlayStation platforms and services), Microsoft (for Xbox and Windows platforms and services), Epic (for Epic Games platform and services), and similar distribution services, we may obtain your name, email address, online ID, country, state or province, language, date of birth, and other social information you provide to them.",C2,we,not_collect,pii,You can also ask us not to collect or use your personal information for certain purposes.||You also have the right to request that we not collect or use your personal information.||We do not knowingly collect personally identifiable information from anyone under the relevant age threshold applicable to the country or jurisdiction where a user may reside.
com.versusevil.likeaboss,we,collect,information about you,"When you connect to our Sites, Services, or Software through a third party, we may collect information about you from these third parties, depending on the third party's terms of service and the privacy settings you have specified.",N1,we,not_collect,pii,You can also ask us not to collect or use your personal information for certain purposes.||You also have the right to request that we not collect or use your personal information.||We do not knowingly collect personally identifiable information from anyone under the relevant age threshold applicable to the country or jurisdiction where a user may reside.
com.apps2us.slither.slink.io,third party,not_collect,pii,Appsbob Studios does not sell or rent your Personal Information to third-parties for marketing purposes without your consent.,C1,third party,collect,pii,Appsbob Studios may share Personal Information with business partners that assist Appsbob Studios in providing you services.
com.apps2us.slither.slink.io,third party,collect,pii,Appsbob Studios may share Personal Information with business partners that assist Appsbob Studios in providing you services.,C1,third party,not_collect,pii,Appsbob Studios does not sell or rent your Personal Information to third-parties for marketing purposes without your consent.
com.askfm,third party,collect,information about you,"We may share information about you with our partners such as your name, postal address, e-mail, or other identifier and may do so in non-human readable format to ensure the security of your information.",N1,third party,not_collect,pii,"When we use a third party to do this, we do not share any personal information with that party, we only provide anonymized questions and answer content and other non-personalised statistical data for analysis purposes."
com.askfm,third party,collect,person name,"We may share information about you with our partners such as your name, postal address, e-mail, or other identifier and may do so in non-human readable format to ensure the security of your information.",C2,third party,not_collect,pii,"When we use a third party to do this, we do not share any personal information with that party, we only provide anonymized questions and answer content and other non-personalised statistical data for analysis purposes."
com.askfm,third party,collect,identifier,"We may share information about you with our partners such as your name, postal address, e-mail, or other identifier and may do so in non-human readable format to ensure the security of your information.",C2,third party,not_collect,pii,"When we use a third party to do this, we do not share any personal information with that party, we only provide anonymized questions and answer content and other non-personalised statistical data for analysis purposes."
com.askfm,third party,collect,pii,"We dont sell or share any personal information about you with third parties, except as provided in this Privacy Policy.||We do not knowingly collect (or knowingly allow any third party to collect) personal information from persons under the age of 13.",C1,third party,not_collect,pii,"When we use a third party to do this, we do not share any personal information with that party, we only provide anonymized questions and answer content and other non-personalised statistical data for analysis purposes."
com.askfm,third party,not_collect,pii,"When we use a third party to do this, we do not share any personal information with that party, we only provide anonymized questions and answer content and other non-personalised statistical data for analysis purposes.",C1,third party,collect,pii,"We dont sell or share any personal information about you with third parties, except as provided in this Privacy Policy.||We do not knowingly collect (or knowingly allow any third party to collect) personal information from persons under the age of 13."
com.askfm,third party,collect,email address,"We may share information about you with our partners such as your name, postal address, e-mail, or other identifier and may do so in non-human readable format to ensure the security of your information.",C2,third party,not_collect,pii,"When we use a third party to do this, we do not share any personal information with that party, we only provide anonymized questions and answer content and other non-personalised statistical data for analysis purposes."
com.askfm,third party,collect,device identifier,"Our partners also may collect information directly from your device, such as your IP address, device ID (which in some countries is considered as personal data) or similar information regarding the location of your mobile device; may combine our personal and non-personal information about you with information from other sources; and may place or recognize a unique cookie on your browser.",C2,third party,not_collect,pii,"When we use a third party to do this, we do not share any personal information with that party, we only provide anonymized questions and answer content and other non-personalised statistical data for analysis purposes."
bestvalleygames.turningvalley,we,collect,pii,We will disclose your Personal Information where required to do so by law or subpoena or if we believe that such action is necessary to comply with the law and the reasonable requests of law enforcement or to protect the security or integrity of our Service.,N1,we,not_collect,email address,"We DO NOT collect sensitive personal information such as your name, email address, phone number, contacts, call history, browsing history, photos, text messages, emails, or payment information."
bestvalleygames.turningvalley,we,collect,pii,We will disclose your Personal Information where required to do so by law or subpoena or if we believe that such action is necessary to comply with the law and the reasonable requests of law enforcement or to protect the security or integrity of our Service.,N1,we,not_collect,phone number,"We DO NOT collect sensitive personal information such as your name, email address, phone number, contacts, call history, browsing history, photos, text messages, emails, or payment information."
